{
  "schema": "highergraphen.test_semantics.input.v1",
  "source": {
    "kind": "code",
    "boundary": "selected_paths",
    "adapter": "rust-test-semantics-from-path.v1"
  },
  "files": [
    {
      "path": "tools/example/tests/command.rs",
      "language": "rust",
      "tests": [
        {
          "name": "emits_json_contract",
          "kind": "unit",
          "assertions": [
            "assert",
            "assert_eq"
          ],
          "command_observations": [
            {
              "label": "acme audit --format json",
              "tokens": [
                "acme",
                "audit",
                "--format",
                "json"
              ]
            }
          ],
          "data_observations": [
            {
              "label": "field:schema",
              "observation_type": "json_field"
            },
            {
              "label": "schema:acme.audit.input.v1",
              "observation_type": "schema_id"
            }
          ]
        }
      ]
    }
  ],
  "execution_cases": [
    {
      "name": "emits_json_contract",
      "status": "passed",
      "matched_tests": [
        "tools/example/tests/command.rs::emits_json_contract"
      ]
    }
  ]
}
